{
  "grantId": "grt_01",
  "namespace": "https://id.example.com/org/acme",
  "action": "orders.read",
  "resource": { "type": "order", "id": "ord_1" },
  "scope": ["read:orders"],
  "task": "task_01",
  "audience": "https://api.example.com",
  "policyVersion": "3",
  "agentEpoch": 4, "identityEpoch": 4,
  "parentLineage": ["dec_01"],
  "expiresAt": 1900000300,
  "cnf": { "jkt": "NzbLsXh8uDCcd-6MNwXF4W_7noWXFZAfHkxZsRGC9Xs" }
}
